title,author,date,article,link
"St. Luke’s to invest P18B in Parañaque hospital, opening in 2029",— Aubrey Rose A. Inosante,"July 17, 2024 | 12:03 am"," ST. LUKE’S Medical Center (SLMC) announced on Monday an P18-billion investment in its Parañaque hospital, with groundbreaking scheduled for October. This expansion reinforces SLMC’s position as the Philippines’ premier destination for medical tourism, SLMC President and Chief Executive Officer Dennis P. Serrano said during a briefing. “The Parañaque facility is going to be a 450-bed hospital, as big and modern as the Global City unit, and the cost is P18 billion,” he added. He said that medical tourism will be a key component of SLMC’s third hospital, slated to commence operations in 2029. The Department of Tourism (DoT) has recognized SLMC as the country’s foremost facility for medical tourism. “Our revenue from foreign patients or international patients will come up around 7% to 10%, which translates into billions,” Mr. Serrano said referring to the gross revenue of its two hospitals in Quezon City and Global City. SLMC anticipates that revenue from international patients will constitute approximately 7% to 10% of its total gross revenue, translating to a figure in the billions, as noted by Mr. Serrano. This pertains to the aggregate revenue generated by SLMC’s two hospitals located in Quezon City and Bonifacio Global City, Taguig City. Tourism Secretary Maria Esperanza Christina G. Frasco said the government aims to position the Philippines as a leading health and wellness tourism destination in Asia and beyond. “We aim to secure our place in the global medical tourism market, which is currently valued at over $63.89 billion and expected to reach over $207 billion by 2030,” she said during an event on July 15. In 2023, the Tourism department recorded over 30,000 arrivals for medical tourism, contributing an estimated $15 billion to $25 billion in receipts. Meanwhile, SLMC Quezon City is undergoing renovation, according to Mr. Serrano.— Aubrey Rose A. Inosante",https://www.bworldonline.com/corporate/2024/07/17/608496/st-lukes-to-invest-p18b-in-paranaque-hospital-opening-in-2029/
Reissued bonds fetch lower rates,"A.M.C. Sy , Reuters","July 17, 2024 | 12:04 am"," THE GOVERNMENT made a full award of the reissued Treasury bonds (T-bonds) on Tuesday at lower rates as the offer was met with robust demand amid expectations of monetary easing by the Bangko Sentral ng Pilipinas (BSP). The Bureau of the Treasury (BTr) raised P30 billion as planned via the reissued 10-year bonds it auctioned off on Tuesday as total bids reached P96.605 billion, or more than thrice the amount on the auction block. The bonds, which have a remaining life of nine years and six months, were awarded at an average rate of 6.212%. Accepted yields ranged from 6.18% to 6.223%. The average rate of the reissued seven-year bonds dropped by 54.2 basis points (bps) from the 6.754% fetched for the series’ last award on June 11 and was 3.8 bps lower than the 6.25% coupon for the issue. This was also 5.6 bps below the 6.268% quoted for the 10-year bond and 0.8 bp lower than the 6.220% seen for the same bond series at the secondary market before Tuesday’s auction, based on PHP Bloomberg Valuation Service Reference Rates data provided by the BTr. To accommodate the strong demand seen for Tuesday’s offer, the BTr opened its tap facility window to raise P20 billion more via the bonds at the same average rate. The government made a full award of the reissued 10-year debt as the offer fetched lower rates on strong demand amid “growing confidence that the BSP will cut sooner and by at least 50 bps total for the year,” a trader said via text message. BSP Governor Eli M. Remolona,Jr. last month said the Monetary Board may deliver its first rate cut in over three years at its Aug. 15 review — the only policy meeting scheduled in the third quarter — as they expect inflation to continue easing this semester. The Monetary Board could reduce borrowing costs by 25 bps in the third quarter and by another 25 bps in the fourth quarter, he said. The BSP last month kept its policy rate at a 17-year high of 6.5% for a sixth straight meeting after raising interest rates by 450 bps from May 2022 to October 2023. The T-bonds on offer fetched lower yields following dovish signals from US Federal Reserve officials, Rizal Commercial Banking Corp. Chief Economist Michael L. Ricafort said in a Viber message. Fed Chair Jerome H. Powell said on Monday the three US inflation readings over the second quarter of this year do “add somewhat to confidence” that the pace of price increases is returning to the Fed’s target in a sustainable fashion, remarks that suggest a turn to interest rate cuts may not be far off, Reuters reported. “In the second quarter, actually, we did make some more progress” on taming inflation, Mr. Powell said at an event at the Economic Club of Washington. “We’ve had three better readings, and if you average them, that’s a pretty good place.” “What we’ve said is that we didn’t think it would be appropriate to begin to loosen policy until we had greater confidence” that inflation was returning sustainably to 2%, Mr. Powell continued. “We’ve been waiting on that. And I would say that we didn’t gain any additional confidence in the first quarter, but the three readings in the second quarter, including the one from last week, do add somewhat to confidence.” Last week, the Labor department reported that its consumer price index fell in June from the month before, the first decline in four years. Economists now estimate the gauge the Fed uses for its inflation target, due out later this month, will show yearly price increases have eased closer toward 2%. The betting among investors has tilted strongly towards the Fed starting rate cuts in September. Changes to the policy statement in July could provide a strong signal of that by updating how inflation is described and assessing how recent data has added to policy makers’ confidence that the pandemic-era outbreak of inflation has subsided. After rapidly lifting interest rates starting in 2022 to combat the worst inflation outbreak since the 1980s, the Fed has left its benchmark policy rate unchanged since last July in a range of 5.25%-to-5.5%. As Mr. Powell spoke,financial markets all but abandoned what had been rising bets on a July rate cut. Traders continue to expect a September rate cut followed by additional cuts in November and December, bringing the policy rate down to 4.5%-4.75% by yearend. The BTr wants to raise P215 billion from the domestic market this month, or P100 billion from Treasury bills and P115 billion via T-bonds. The government borrows from local and foreign sources to help fund its budget deficit, which is capped at P1.48 trillion or 5.6% of gross domestic product for this year. —A.M.C. SywithReuters",https://www.bworldonline.com/banking-finance/2024/07/17/608399/reissued-bonds-fetch-lower-rates/
Hann Resorts plans up to P20-B IPO next year — gaming regulator, Reuters,"July 17, 2024 | 12:04 am"," HANN Resorts, an operator and owner of an integrated casino-resort in the Philippines, is planning an initial public offering (IPO) worth P15 billion to P20 billion ($256.6 million to $342.2 million), the chief of the country’s gaming regulator said on Tuesday. The deal could be the largest maiden share sale in the Philippines since MREIT, Inc.’s P15-billion IPO in 2021, and could match the amount raised by another integrated casino-resort IPO more than a decade ago. Hann Resorts, led by Korean Dae Sik Han, has a target of listing on the Philippine bourse early next year, Alejandro H. Tengco, chairman of the Philippine Amusement and Gaming Corp., told Reuters. “The growth story is they have a casino expansion including three championship golf courses and five-star hotels,” Mr. Tengco said. The Philippine gambling sector, which includes a smaller version of the Las Vegas Strip in Manila, attracts high rollers from countries including China, Japan and South Korea. Hann Resorts is weighing whether it can pursue an IPO this year, with fresh capital allotted for expanded gaming activities and the development of luxury estate Hann Reserve, a banking source with knowledge of the deal said on Tuesday. Hann Resorts’ Mr. Han did not immediately respond to a request for comment. The news of the IPO was first reported by news site InsiderPH on Monday. Hann Resorts owns a casino-resort with 147 gaming tables, 868 slot machines, two VIP clubs, and two five-star hotels in a former US military air base in Pampanga province. Its parent firm, Hann Philippines, is spending around $2 billion for Hann Reserve, a 450-hectare luxury estate development at the adjacent Tarlac province, and is among the up to $6 billion worth of investments being made into the Philippines’ casino sector in the next five years, according to the gaming regulator. Among the Philippines’ integrated casino-resort operators, only Travellers Group, a joint venture between Genting Hong Kong Ltd. and a Philippine conglomerate, conducted an IPO but its owners took it private six years later in 2019. —Reuters",https://www.bworldonline.com/corporate/2024/07/17/608490/hann-resorts-plans-up-to-p20-b-ipo-next-year-gaming-regulator/
Oliver Jeffers makes climate picture books for adults and kids alike,Bloomberg,"July 17, 2024 | 12:04 am","AT HIS studio in Belfast, Oliver Jeffers sits in front of a poster of the moon’s phases. He leans forward to talk about his work, revealing more of the image behind him. In the center of the lunar chart, the Earth emerges from behind Mr. Jeffers’s head. We’re talking about the Earth in the wrong ways, Mr. Jeffers says. “It’s not true that the planet is broken. It is doing exactly what it should with the input it’s receiving,” he says. “It’s going to be around long after we’re gone. Life as we know it—that’s what’s in danger.” Jeffers is a visual artist, author, and climate activist whose oeuvre spans picture books, fine art, andlarge-scale installations. At COP26 in Glasgow, he installed two “siblings sculptures” of the Earth that he hoped would remind negotiators of the need for unified policies. In 2022, he crafted a six-mile recreation of the solar system in Northern Ireland, where he lives. And in 2017, fatherhood inspired Mr. Jeffers’s book,Here We Are, which explains the planet to kids. This week, Mr. Jeffers is presenting and performing a live reading at theBloomberg Green Festivalin Seattle, a gathering of artists, entrepreneurs and activists. There’s often a sense of scale and wonder in Jeffers’s work, a reflection of his view that emphasizing unity is more effective in the climate fight than leaning into blame. “My granny always said you catch more flies with honey than with vinegar,” he says. “Humor can be incredibly disarming. I think it’s one of the most underutilized tools in the battle against indifference to climate change.” InHere We Are, for example, Jeffers drew on children’s hopeful feelings about the planet. “As I was walking around with a newborn baby, I was thinking… ‘Earth is beautiful and tremendous,’” he says. “And I thought other people would benefit from reminding themselves of these things they intuitively knew as children.” Mr. Jeffers argues that isolationism and nationalism make it easier for people to lose sight of the planet. In his COP26 sculpture, he inscribed all dry land with the phrase “People Live Here” and the oceans with “Nobody Lives Here,” a critique of the borders people use to divide themselves. When humans think about the planet in terms of large, abstract groups, it gives them permission to ignore climate change, Mr. Jeffers says. Mr. Jeffers has been surprised by the reach of some of his work. He first conceived ofBegin Again—a picture book that looks at human history from its beginnings to today—as geared at adult audiences, figuring it would go over children’s heads. But when he took the book on tour, he found it resonated with kids as well, and sparked meaningful dialogue between parents and their children. Those reactions are among his favorites, he says. Another reaction for the highlight reel: At COP26, Mr. Jeffers recalls a man approaching him to say that he had forgotten the Maldives in his sculpture of the Earth. They talked about how difficult it is to include every island nation, then the man introduced himself: “I’m the president there.” Mr. Jeffers handed him the paintbrush, and the president added the island himself.—Bloomberg",https://www.bworldonline.com/bloomberg/2024/07/17/608451/oliver-jeffers-makes-climate-picture-books-for-adults-and-kids-alike/
"A-FLOW, LANDBANK ink P2.4-B loan for data center in Laguna",— Revin Mikhael D. Ochave,"July 17, 2024 | 12:05 am"," A-FLOW Properties I Corp. (A-FLOW) and Land Bank of the Philippines (LANDBANK) recently signed a P2.4-billion loan agreement for the establishment of a data center campus in Biñan, Laguna The loan facility will be used for the development of the initial phase of the first A-FLOW data center campus and is the first tranche of a P10.8-billion ten-year loan facility with LANDBANK. Currently under construction, the six-megawatt IT capacity Phase 1A of the three-building data center campus project is scheduled to be ready-for-service by the end of the year. “This agreement marks a significant step forward in our shared commitment to develop the largest carrier-neutral data center campus in the Philippines. We are excited to build an ecosystem to attract a combination of international hyperscale customers and local enterprise customers,” A-FLOW President Amandine Wang said in an e-mailed statement on Tuesday. A-FLOW is a joint venture between listed AyalaLand Logistics Holdings Corp. (ALLHC) and FLOW Digital Infrastructure that invests, develops, and operates digital infrastructure in the Asia-Pacific region. “This is the first data center project financed by LANDBANK, and with this new partnership, we are confident that this project will yield significant economic benefits,” LANDBANK President and Chief Executive Officer Ma. Lynette V. Ortiz said. Meanwhile, ALLHC Chairman Anna Ma. Margarita B. Dy said that digital transformation, cloud computing, and the surge of artificial intelligence are technologies that need “robust and scalable data center solutions.” “Like any other infrastructure project, capital is key. So, we thank LANDBANK for the P10.8-billion loan facility to A-FLOW, a critical enabler for this project,” she said. ALLHC is a subsidiary of listed property developer Ayala Land, Inc. (ALI). On Tuesday, ALLHC shares rose by 0.52%, or one centavo, ending at P1.94 apiece, while ALI stocks increased by 3.26%, or P1, finishing at P31.70 per share.— Revin Mikhael D. Ochave",https://www.bworldonline.com/corporate/2024/07/17/608491/a-flow-landbank-ink-p2-4-b-loan-for-data-center-in-laguna/
"Decades after Billie Holiday’s death, ‘Strange Fruit’ is still a searing testament to injustice — and of faithful solidarity with suffering",,"July 17, 2024 | 12:05 am","SIXTY-FIVE years ago, on July 17, 1959, Billie Holiday died at Metropolitan Hospital in New York. The 44-year-old singer arrived after being turned away from a nearby charity hospital on evidence of drug use, then lay for hours on a stretcher in the hallway,unrecognized and unattended. Her estate amounted to70 cents in the bank and a roll of billsconcealed on her person, her share of the payment fora tabloid interviewshe gaveon her deathbed. Today, Holiday is revered as one of the most influential musical artists of all time.Timemagazine namedher 1939 recording of “Strange Fruit”the song of the 20thcentury. “In this sad, shadowy song about lynching in the South,”Timewrote in 1999, “history’s greatest jazz singer comes to terms with history itself.” Abel Meeropol, a New York City teacher and songwriter who used the pen name Lewis Allan, wrote “Strange Fruit” after seeing a photograph of a lynching thatshocked and haunted him: “Black body swinging in the Southern breeze / Strange fruit hanging from the poplar trees.” Holiday’s rendition of Meeropol’s song remains as stunning — and searing — today as when it was first recorded. “It hits, hard,” syndicated columnist Samuel Grafton wrote soon after the record’s release in 1939. “It is as if a game of let’s pretend had ended.” I’ma scholar of American religion,literature, andthe arts, and I’m interested in the ways that even powerfully secular works draw energy from religious narratives of justice, injustice, truth-telling and redemption. I find “Strange Fruit” a resonant example. (See the video of Billie Holiday singing “Strange Fruit” here:https://tinyurl.com/33cx7kf9.) UNFLINCHING LYRICSLike so many composers whose songs Holiday recorded —George and Ira Gershwin,Irving Berlin,Jerome Kern— Meeropol came from a family of Jewish immigrants to America who fled antisemitic violence in Europe. Two Great Migrations defined America in the early 1900s:rural South to industrial North, andOld World to New. Bothwere driven, in part, by the desire toleave racial terror behind. Together, these migrations enabled some of the most enduring musical collaborations of the 20thcentury. Thematically, the joint productions of Black and Jewish musical artists — Broadway productions ofShow BoatandPorgy and Bess, Holiday’s performances withBenny GoodmanandArtie Shaw— tended to sidestep the brute realities of prejudice, focusing instead on the luxury of ordinary happiness and unhappiness. “Strange Fruit” was different. The song gazes unflinchingly on the “strange fruit” of the title: hanged, burned, and mangled flesh left to rot on a tree. Well into the 20thcentury, white vigilante mobsmurdered thousands of Black Americans with impunity: lynching then leaving their bodies on display as a terrorist spectacle. Meeropolfirst jotted the song’s words and musicon the back of a cabaret program dated Nov. 13, 1938 — four days after Kristallnacht,the night of murderous anti-Jewish rampagesthroughout Nazi Germany that became a tipping point for the Holocaust. For Meeropol, a labor activist and a secular Jew,Black and Jewish Americans marched shoulder to shoulderin the cause of freedom from injustice. In another poem,he connected anti-Black violence with the persecutions of Jews: I am a Jew.How may I tell?The Negro lynchedReminds me wellI am a Jew. BLACK CHRISTAs Meeropol linked anti-Black and anti-Jewish prejudice, many Black Christians also connected their suffering with that of the Hebrew slaves in the Bible — and with Jesus’ own. According totheologian James Cone, “Black ministers preached about Jesus’ death more than any other theme because they saw in Jesus’ suffering and persecution a parallel to their own encounter with slavery, segregation,and the lynching tree.” In the decade Holiday recorded “Strange Fruit,” Harlem Renaissance writersW.E.B. Du Bois,Countee Cullen, andLangston Hughesall centered works around the figure of thecrucified Black Christ. Most African American Christiansbelong to Protestant churches, but Holiday did not. As a child she was baptized Catholic at a convent reform school,Baltimore’s House of the Good Shepherd for Colored Girls, where she was twice sent by the courts. She remained ambivalently Catholic for the whole of her life. THE FILLED CROSSProtestant churches commonly display the “empty” cross, showing the instrument of Jesus’ execution, but not his body. The message of the empty cross is resurrection and new life. According to the Christian story, Jesus was crucified, buried,and rose from the deadto redeem humankind from sin. In Catholic settings, one is more likely to find the “filled” cross: the body of Jesus with arms outstretched, hands and feet nailed to the wood. The crucifix emphasizes the agony of Jesus’ death and his solidarity with all who suffer. The filled cross also communicates the message that the crucifixion of Christ — God in human form — is not a once-and-for-all event. “When [Meeropol] showed me that poem,” Holiday said of “Strange Fruit,” “I dug it right off” because it “seemed to spell out all the things that had killed Pop.” Her father, jazz guitarist Clarence Holiday, died at 39 while touring in Texas. She believed he’d been refused lifesaving care because of his race. Holiday’s “Strange Fruit” evokes the filled cross in its testament to lynching as ongoing reality. “It still depresses me every time I sing it,” Holiday saidin her autobiography. “But I have to keep singing it … the things that killed him are still happening in the South.” Journalist Vernon Jarrettrecalled seeing Holiday perform in 1947. She was “singing this songas though this was for real, as though she had just witnessed a lynching,” Jarrett said of “Strange Fruit.” “There was a sense of resignation, as if ‘these people are going to have power for a long time and I can’t do a damn thing about it except put it in a song.‘” ONGOING TESTAMENTKeeping company with brokenness, rather than transcending or overcoming it, also describes Holiday’s way of relating to others in precarious circumstances. Her Harlem apartment,she said, was a “combination YMCA, boardinghouse for broke musicians, soup kitchen for anyone with a hard-luck story, community center, and after-hours joint.” A 1943 papal encyclical described the church itself similarly, asa place of shared pain, solace and sustenance. Anyone without money “could go there and eat,” poet and jazz vocalistBabs Gonzales recalled of Holiday’s place. “She fed everybody in New York for four years.” Holiday closed sets with “Strange Fruit” from 1939 until the final months of her life. In making it her trademark song, she offered solidarity and faithful witness to racial violence and injustice, not the remedy for these. But her testament carried extraordinary power. Shortly after the 2020 murder of George Floyd, Bruce Springsteen, afellow Catholic with “misgivings,” madea playlist for America. First on his list was “Strange Fruit.” Asked whether he was optimistic about the future, Springsteen answered in the spirit of Holiday: witness, not triumph. “I don’t think anybody truly knows where we’re going from here,”he told writer David Brooks. But everyone “can see right now that the status quo is not okay. And that’s progress.”  Tracy Fessendenis a professor of Religious Studies at Arizona State University. She has received funding from the National Endowment for the Humanities, the Henry Luce Foundation, and the American Council of Learned Societies.",https://www.bworldonline.com/arts-and-leisure/2024/07/17/608452/decades-after-billie-holidays-death-strange-fruit-is-still-a-searing-testament-to-injustice-and-of-faithful-solidarity-with-suffering/
"Manila Water project targets 700,000 new customers in Taguig by 2025",— Sheldeen Joy Talavera,"July 17, 2024 | 12:06 am","MANILA Water Co., Inc. said it targets to finish its P577-million pipelaying project by early 2025, aiming to provide service to 700,000 more customers in Taguig City. The 3.45-kilometer Long Term East 3 (LTE 3) Ruhale-Bambang Felix Line pipelaying project will pass through the areas of Ruhale M. Natividad, Bambang Felix, DM Cruz, F. Manalo, Bantayan Extension, and Cayetano Boulevard, the company said in a statement on Tuesday. The project is projected to provide an additional 200 million liters per day of treated water coming from new water sources to Taguig, Pateros, Pasig, and portions of Parañaque as part of long-term supply augmentation. “The LTE 3 Ruhale-Bambang Felix Line will be a vital part of Metro Manila’s water security,” Manila Water’s Corporate Communication Affairs Group Director Jeric T. Sevilla said. The project will become part of the company’s LTE 3 Distribution Network System connected to new water sources, namely the East Bay Water Treatment Plant and Wawa-Calawis Water Supply System, as well as other long-term sources such as the Kaliwa Dam. Manila Water serves the east zone network of Metro Manila, covering parts of Marikina, Pasig, Makati, Taguig, Pateros, Mandaluyong, San Juan, portions of Quezon City and Manila, and several towns in Rizal province.— Sheldeen Joy Talavera",https://www.bworldonline.com/corporate/2024/07/17/608492/manila-water-project-targets-700000-new-customers-in-taguig-by-2025/
