title,author,date,article,link
Every sTEP counts: The E-Waste Project’s 12,,"July 17, 2024 | 10:00 am","With ever-advancing technology come the mounting piles of waste thrown out for each electronic upgrade we buy. Electronic waste (e-waste) has increasingly grown at an alarming rate reaching thrice the world’s population growth as of 2014, and presumably even higher with a decade gone by. E-waste refers to obsolete or discarded electronic devices containing toxic chemicals such as dioxins, lead, and mercury. These substances pose harmful effects to human health when improperly disposed of, especially for pregnant women and children. For over 12 years, The E-Waste Project (TEP) has been raising awareness for responsible e-waste management and disposal within the community through collection drives, webinars, and online campaigns. This project is an awareness program byUP Circuitdesigned to address the growing issue of e-waste in the country and educate people on how to tackle it. The initiative’s latest iteration in 2023 achieved its largest collection yet, amassing a total of 9,654 kilograms of electronic waste. With hopes of a greater reach in their advocacy, The E-Waste Project will conduct their series of events this July 2024. There will be twoTEP Talks, which are online webinars aimed at educating and motivating individuals to identify and address the issues associated with improper e-waste disposal. The first TEP Talk will be held onJuly 20with the topic “E-Waste and Health: Understanding the Risks.” On the other hand, the second webinar will take place onJuly 27, with the topic on “Reducing E-Waste: Tips for Minimizing Electronic Waste at Home.” Both TEP Talks will start at 2 p.m. via Zoom and will also be livestreamed on TEP’s Facebook Page. Interested attendees can join through the registration link posted on The E-Waste Project’s social media pages. A great addition to the TEP projects, calledTEP2F,was also introduced in June. Selected members of the team visited the PropertyCompany of Friends, Inc. in Mandaluyong and Tzu Chi Scholars Summer Camp in Sta. Mesa to talk about the environmental impact of e-waste and its practical disposal solutions. TEP will also be relaunching itsin-person collection drivefromJuly 21 to 27, 2024,at theEngineering Lawn, UP Diliman. Drop-off points are already available starting July 8 and will be open until the last day of the collection drive on July 27. The drop-off points are spread across the University of the Philippines-Diliman Campus and at the Buddhist Tzu Chi Campus in Sta. Mesa, Manila. The E-Waste Project advocates for innovation that serves as a tool that we can leverage to enhance sustainability and protection rather than be the cause of more environmental problems. In its 12thyear, the E-Waste Project continues to widen its reach through new events and greater influence with the help of all volunteers and participants. There is a responsibility that comes with today’s advancements and every sTEP taken towards addressing this current problem is progress to a better and greener future.Para sa bayan, para sa mundo.",https://www.bworldonline.com/sparkup/2024/07/17/608618/every-step-counts-the-e-waste-projects-12th-year-in-environmental-service/
Visitor receipts rise by 33% in first half,Justine Irish D. Tabile,"July 12, 2024 | 12:31 am"," VISITOR RECEIPTS rose by 33% in thefirst six months of 2024, while international arrivals hit 3.17 million as of July 10, the Department of Tourism (DoT) said on Thursday. In a statement, the DoT said tourism receipts from inbound visitors hit P282.17 billion in the January-to-June period, about 32.8% higher than P212.47 billion a year earlier. The country welcomed 3.17 million inbound tourists as of July 10. Majority or 92.6% were foreign tourists, while the rest were overseas Filipinos. The latest tally represents 41.2% of the department’s 7.7 million target for international visitor arrivals this year. “This rise from last year’s figures not only showcased the growing appeal of the Philippines as a premier travel destination but also underscored the tangible benefits that tourism brings to our economy and our people,” said Tourism Secretary Maria Esperanza Christina G. Frasco. South Korea remained the top source of foreign arrivals during the period, accounting for 26% or 824,798 of the total. Rounding up the top five sources of inbound tourists are the United States with 522,667 (16.5%), China with 199,939 (6.3%), Japan with 188,805 (6%) and Australia with 137,391 (4.3%). Other sources of tourists include Taiwan, Canada, the United Kingdom, Singapore and Malaysia. Citing the 2024 Economic Impact Research of the World Travel & Tourism Council (WTTC), the DoT said 2024 is forecast to be a “record-breaking” year for the Philippines in terms of the tourism industry’s economic contribution, employment, and visitor spending. In its report, WTTC projected the travel and tourism sectors’ contribution to the national economy to reach P5.4 trillion this year. This will be a 25% increase from last year and will surpass the pre-pandemic level in 2019 by 7.1%, the DoT said. Philippine Statistics Authority data showed the tourism industry’s direct gross value added, which measures the value generated from various tourism-related activities, stood at P2.09 trillion in 2023, accounting for 8.6% of gross domestic product. Meanwhile, the WTTC pegged international and domestic visitor spending at P715.6 billion and P3.7 trillion, respectively, this year. This will exceed 2019 levels by 5.7% and 1.8%, respectively. In 2023, tourism-related spending by nonresidents was P697.46 billion, while domestic visitor spending was P2.67 trillion. “In the second half of the year, we anticipate these numbers to increase, not only the revenue generated but most importantly, the number of Filipinos employed in tourism-related industries,” Ms. Frasco said. At the MICE (meetings, incentives, conferences, and exhibitions) Con 2024 held at the SMX Convention Center in Clark, she said the tourism industry employed over 6.21 million Filipinos last year, representing a 6.4% growth from 2022. Citing WTTC, the DoT said the travel and tourism industry is projected to account for 9.5 million jobs, or 20% of the national workforce, this year. Meanwhile, Ms. Frasco said the development of the MICE sector is crucial to generating employment opportunities and livelihoods for Filipinos. “One of our strategic goals is to diversify our tourism portfolio by investing in high-value tourism products, services and experiences such as MICE and other special events in tourism,” she said. She said MICE tourism is a big opportunity because delegates spend an average of over $573 per day, about five times more than the average leisure tourist. “By positioning the Philippines as a premier MICE destination in Asia, we foster economic growth and provide invaluable opportunities for expansion,” she added. However, she said the country still faces challenges in positioning itself as a MICE powerhouse. “That is why we have worked in collaboration with our fellow government agencies in order to ensure that we improve accessibility and connectivity, as well as opportunities for our communities to benefit from our thriving tourism sector,” she said. —Justine Irish D. Tabile",https://www.bworldonline.com/top-stories/2024/07/12/607651/visitor-receipts-rise-by-33-in-first-half/
"You win some, you lose some in peso battle","Aaron Michael C. Sy, ","July 12, 2024 | 12:32 am","ByAaron Michael C. Sy,Reporter THE PHILIPPINE peso’s steady decline against the dollar — an almost two-year record low — is no longer a black-and-white case of exporters and other dollar earners winning and heavy corporate borrowers losing big time. The same can be said about the Bangko Sentral ng Pilipinas’ (BSP) steady march toward monetary easing in the coming months for the first time since November 2020, which begs the question of who will win and who will lose once the rate cuts are finally delivered. Take the case of Mega Prime Foods, Inc., a leading brand of sardines and other canned fish products that is now forced to manage costs and investments more intensely because its packaging, raw materials, finished goods and other key capital expenditures are foreign currency denominated. “We are not hedged in our revenue and spending,” Chief Executive Officer Michelle Tiu Lim-Chan said in a Viber message. “On the other hand, it is better for our export business, but our primary source of revenue is the domestic market.” Tricia Anna Enriquez, a 25-year-old freelancer based in Manila, is earning P1,000 ($17) more weekly as the peso, which has lost more than P3 against the dollar this year, continues to dive in value. “The dollar is strong, so I earn a lot more now,” she toldBusinessWorld.“My usual P15,000-a-week income is now P16,000.” The peso closed at P58.305 per dollar on Thursday, strengthening by 1.5 centavos from its P58.32-a-dollar finish on Wednesday. This was the peso’s strongest finish in more than a month or since its P57.97 close on May 28. It has been trading at the P58-a-dollar level since May, a weakness that the Philippine central bank has attributed to safe-haven demand for the dollar amid geopolitical tensions and hawkish signals from the US Federal Reserve. John Paolo R. Rivera, president and chief economist at Oikonomia Advisory & Research, blames the Fed, which has kept interest rates at a two-decade high amid stubborn inflation, for the dollar’s strength. “This benefits exporters and overseas Filipino workers (OFWs) and those earning foreign currency because their dollar earnings now have more value in pesos,” he said in a Viber message. The BSP’s signals of an early policy easing before the Fed has led to further peso depreciation, Leonardo A. Lanzona, an economics professor at the Ateneo de Manila University, said in an e-mail. “Indeed, the dollar value has strengthened, but the immediate effect of prospective lowered interest rates here even before the Fed reduces their rates seems to have created greater damage,” he said. The BSP would probably cut its policy rate after the US Federal Reserve, which had signaled it might start easing as late as December, Finance Secretary Ralph G. Recto said earlier. Mr. Recto, who is a member of the BSP’s policy-making Monetary Board, expects as much as 150 basis points (bps) of cuts in the next two years. On the other hand, BSP Governor Eli M. Remolona, Jr. has signaled a rate cut as early as August — potentially before a Fed easing. Total rate cuts this year could go as high as 50 bps, he said. The Monetary Board has kept its benchmark rate steady at a 17-year high of 6.5% since October 2023 after 450 bps in rate increases to tame prices. Jonathan L. Ravelas, senior adviser at Reyes Tacandong & Co., said the growing sea tensions between the Philippines and China are adding to the peso jitters. Local importers are clearly disadvantaged by the weaker peso because their purchases are mostly dollar-denominated, while exporters benefit because their products are now worth more, he pointed out. DOUBLE-EDGED SWORDWhile this is true, the benefits are far from equal among exporters. “Exporters that generate more local value-added are expected to reap larger benefits,” Trade Undersecretary Jose Edgardo G. Sunico said in a Viber message. These include resource-based and service exporters such as companies in the information technology, business process management and tourism sectors, he added. “The impact of a weaker Philippine peso on exports varies across sectors,” Mr. Sunico said. Exports should benefit as Philippine goods and services become more price competitive, but those that rely heavily on imported raw materials and inputs would benefit less, he added. “The business outlook will be impacted by these market dynamics, with exporters remaining optimistic about growth, while import-reliant industries are more cautious of the economic challenges posed by a weaker peso,” Mr. Sunico said. While importers are probably hurt by the depreciating peso, they are far from helpless, Sergio Ortiz-Luis, Jr., president of the Philippine Exporters Confederation, Inc., said by telephone. Filipino importers particularly in the agriculture sector are now trying to use local raw material substitutes to ease the blow from the strong dollar, he said. “So their consumable goods will have fewer import [components],” he said in mixed English and Filipino. The peso’s persistent weakness can also be a double-edged sword for Filipino families that rely on a relative who works overseas. A strong dollar means more value in remittances sent by OFWs, Ellene A. Sana, executive director of the Center for Migrant Advocacy, said by telephone. But they could likewise end up sending less dollars given the higher peso value of these remittances, Mr. Ravelas said. Cash remittances from OFWs rose by 3.1% year on year to $2.562 billion in April — the fastest since December but the lowest in 11 months, according to BSP data. Month on month, remittances fell by 6.4%. The peso depreciated by P1.52 against the dollar that month. OFW families like most Filipinos obviously have to contend with rising prices including food. “Inflation is rising faster compared with the peso’s weakening, so the effect on OFWs could still be negative,” Ms. Sana said. “If you’re sending the same amount of dollars, the worth in peso could be higher but it will afford less goods,” she said. Despite remittance optimism due to the dollar’s strength, OFWs are still wary about sticky inflation, Ms. Sana said. Inflation eased to 3.7% in June from 3.9% in May, still within the BSP’s 2-4% annual target. It averaged 3.5% in the first half. “You have to connect it to the end user of the money. Your end user, who is in the Philippines, is finding inflation problematic,” Ms. Sana said. Mr. Lanzona said local companies are more exposed to the weak peso. “This group has been among the most active spenders and borrowers of dollar-linked instruments over the past decade, either by choice due to lower cost or by necessity given the [limited] size of domestic funding sources,” he said. While companies in other Southeast Asian countries are standing up to the dollar, local companies big and small face difficulties in expanding production or exports and are failing to take advantage of the depreciation, he added. The peso would likely continue its free fall in the coming months due to inflation and slowing demand for domestic funds, which could force the BSP to intervene in the currency market, the economist said. It could also keep rates high, which could slow economic growth targeted at 6-7% this year, he pointed out. The Philippine economy grew by 5.7% in the first quarter, slower than expected. Mr. Ravelas expects a persistently weak peso until the Fed finally begins its easing cycle. The peso would probably end the year at P58 as it gets boosted by remittances during the Christmas holiday — still weaker than the P55 to P56 levels reached at the start of the year.",https://www.bworldonline.com/top-stories/2024/07/12/607647/you-win-some-you-lose-some-in-peso-battle/
PHL banks’ total assets up 12.4% as of end-May,"Luisa Maria Jacinta C. ,Jocson, ","July 12, 2024 | 12:33 am","ByLuisa Maria Jacinta C.Jocson,Reporter THE PHILIPPINE banking industry’s total assets jumped by an annual 12.4% as of end-May, Bangko Sentral ng Pilipinas (BSP) data showed. Banks’ combined assets increased to P25.62 trillion from P22.79 trillion a year ago, according to preliminary data. Month on month, total assets inched up by 0.5% from P25.48 trillion as of end-April. Banks’ assets are mainly supported by deposits, loans, and investments. These include cash and due from banks as well as interbank loans receivable (IBL) and reverse repurchase (RRP), net of allowances for credit losses. The banking sector’s total loan portfolio inclusive of IBL and RRP climbed by 10.4% to P13.42 trillion as of end-May from P12.16 trillion in the previous year. Net investments, or financial assets and equity investments in subsidiaries, increased by 11.3% to P7.47 trillion from P6.71 trillion a year ago. Cash and due from banks stood at P2.69 trillion as of end-May, up by 2% from P2.64 trillion a year earlier. Net real and other properties acquired increased by 7.2% to P108.19 billion from P100.93 billion a year ago. Banks’ other assets surged by 63.4% to P1.93 trillion from P1.18 trillion a year earlier. Meanwhile, the total liabilities of the banking system rose by 12.8% to P22.5 trillion from P19.95 trillion in the year-ago period. Rizal Commercial Banking Corp. Chief Economist Michael L. Ricafort said the higher asset level as of end-May showed the banking sector’s strong growth. “This is again more than twice faster than gross domestic product (GDP) growth, largely attributed to the sustained double-digit growth in the net income of banks, considered among the most profitable industries in the country,” he said in a Viber message. Earlier data from the central bank showed that the banking industry’s net income had risen by 2.95% to P92.107 billion as of end-March. This is also in line with faster loan growth in recent months, Mr. Ricafort said. Bank lending grew by 9.6% to P11.91 trillion as of end-April, latest data from the BSP showed. Mr. Ricafort also cited the continued recovery of the economy and business activities from the coronavirus disease 2019 (COVID-19) pandemic. He said possible policy rate cuts would “further boost trading gains and other investment income of banks” in the coming months. BSP Governor Eli M. Remolona, Jr. has said the central bank is on track to begin cutting rates by August, for a total of 50 basis points (bps) worth of cuts for 2024. The Monetary Board is set to hold its next policy review on Aug. 15. If the BSP begins policy easing in August, this would be the first rate cut in over three years or since the central bank last delivered a 25-bp cut in November 2020 amid the COVID-19 pandemic. Market players are also anticipating the possibility of the US Federal Reserve cutting rates as early as the third quarter. US Federal Reserve Chairman Jerome H. Powell told lawmakers that “more good data” would build the case for rate cuts. The odds of a rate cut in September are about 75% and will get the next cue from data later in the day that were expected to show easing US inflation, Reuters reported.",https://www.bworldonline.com/top-stories/2024/07/12/607648/phl-banks-total-assets-up-12-4-as-of-end-may/
PHL likely to be ‘big winner’ once India eases rice export restrictions, Luisa Maria Jacinta C. Jocson,"July 12, 2024 | 12:34 am"," THE PHILIPPINES is seen to benefit the most from an expected decline in global rice prices once India relaxes restrictions on rice exports, Nomura Global Markets Research said. “We expect the Philippines to be the biggest winner in Asia, given the high share of rice in its consumer price index (CPI) basket, its dependence on rice imports and recent rice import tariff reductions,” it said in a report. “The Philippines will likely benefit most from falling international rice prices, via positive terms-of-trade effects and easing domestic food price inflation.” Market participants are expecting India, the world’s largest exporter of white rice, to relax restrictions on rice exports soon. Last year, India suspended exports of non-basmati white rice amid concerns over domestic supply. “Since India accounted for 35% of global rice exports in 2022, making it the top rice exporter in the world, its export restrictions pushed up global rice prices and hurt rice importing nations globally,” Nomura said. “In our view, India is likely to gradually remove the restrictions on its rice exports in coming months,” it added. Nomura said it sees “brighter” prospects for the Philippines, which is highly dependent on imported rice. “Net rice imports accounted for 0.4% of its gross domestic product (GDP) in 2023, the highest in Asia. As such, lower global rice prices should have the most beneficial impact on the Philippines, followed by Indonesia,” it said. The US Department of Agriculture (USDA) expects Philippine rice imports to hit 4.6 million metric tons (MMT) this year, higher than the Agriculture department’s 3.9 MMT projection. As of June 27, the Philippines had imported 2.31 MMT of rice, latest data from the Bureau of Plant Industry showed. “Without price controls or subsidies, the pass-through to domestic rice prices is also significant and swift, contributing to more downward pressures on headline inflation, which is already set to be impacted by the government’s announcement of a substantial rice import tariff reduction,” Nomura said. President Ferdinand R. Marcos, Jr. last month signed Executive Order No. 62, which slashed tariffs on rice imports to 15% from 35%, until 2028. The measure is expected to bring down retail rice prices by P6 to P7 per kilo, the Agriculture department said earlier. Nomura noted the weight of rice in the Philippines’ CPI basket at 8.9%, which is “much higher” than its neighboring countries. In June, rice inflation eased to 22.5% from 23% a month ago. This marked the third straight month of slower rice inflation. Rice accounted for 45.2% of overall inflation, equivalent to 1.7 percentage points. “Easing inflation would further support our view that BSP will start its easing cycle by October, although the risk of an earlier first rate cut (i.e., in August) is rising, given recent comments by Governor Remolona that BSP does not have to wait for the Fed,” Nomura added. Roehlano M. Briones, a senior research fellow at the Philippine Institute for Development Studies, said rice prices could further decline if India eases its restrictions. “The rice tariff cut is expected to reduce the price by about P7. (Prices can go) lower if India lifts restrictions,” he said in a Viber message. Latest data from the Agriculture department showed that the average price of well-milled rice ranged from P48-55 per kilogram as of July 10, while regular milled rice was P45-52. “There could be a further decline in import prices, but exporters to the Philippines could also adjust their prices upwards knowing that we have reduced our tariffs,” Raul Q. Montemayor, national manager of the Federation of Free Farmers, said in a Viber message. “It remains to be seen whether rice retail prices will go down and benefit consumers,” he added. Mr. Montemayor said that based on his computations, the margin between import and retail prices shrink when import prices go up. “Once import prices go down coupled with the lowered tariff rate, market intermediaries might just recoup the margins they lost and not pass on any benefit to consumers.” —Luisa Maria Jacinta C. Jocson",https://www.bworldonline.com/top-stories/2024/07/12/607649/phl-likely-to-be-big-winner-once-india-eases-rice-export-restrictions/
Marcos appoints top banker to MB,Kyle Aristophere T. Atienza ,"July 12, 2024 | 12:35 am","PRESIDENT Ferdinand R. Marcos,Jr. has appointed banker Walter C. Wassmer to the Bangko Sentral ng Pilipinas’ (BSP) rate-setting body, according to a Palace statement. Prior to his appointment, Mr. Wassmer was a consultant and nonexecutive director of Sy-led BDO Unibank, Inc., the country’s largest bank in terms of assets. The announcement comes weeks after the resignation of two Monetary Board (MB) members who were embroiled in a scandal involving “ghost employees.” A Bloomberg report earlier said Malacañang had accepted the resignation of MB members Anita Linda R. Aquino and V. Bruce J. Tolentino, effective June 30. When asked whether Mr. Marcos has found a replacement for the remaining MB vacancy, Presidential Communications Office Secretary Cheloy Velicaria-Garafil said in a Viber message: “None for now.” Mr. Wassmer and the other appointee will complete the unexpired terms of Ms. Aquino and Mr. Tolentino or until July 2026. Mr. Wassmer is a seasoned banker, having held positions at BDO, Far East Bank and Trust Co. and Union Bank of the Philippines, Inc. (UnionBank).He was also a senior board adviser at Lopez-led First Philippine Holdings Corp. from November 2022. Mr. Wassmer was senior executive vice-president and head of institutional banking group at BDO from 1997 to 2022. He was chairman and officer-in-charge of BDO Elite Savings Bank, Inc. He was also senior vice-president of the Far East Bank from 1986 to 1997; assistant vice-president of UnionBank from 1983 to 1986; and corporate account officer of the Bancom Finance Corp. from 1980 to 1982. He has also held director positions in several companies, including BDO Finance Corp., MMPC Auto Financial Services Corp. and Mabuhay Vinyl Corp. Mr. Wassmer holds a Bachelor of Science degree in Commerce from De La Salle University. The Monetary Board exercises the powers and functions of the BSP including the conduct of monetary policy. It is composed of seven members including BSP Governor Eli M. Remolona, Jr. The other MB members are Finance Secretary Ralph G. Recto, former BSP Governor and Finance Secretary Benjamin E. Diokno, former Finance Undersecretary Romeo L. Bernardo and former National Treasurer Rosalia V. de Leon. The Monetary Board’s next meeting is scheduled for Aug. 15. Mr. Remolona has said the BSP is still “on track towards reducing rates” despite risks to the inflation outlook. He earlier said that the central bank could cut rates by 25 basis points (bps) in the third quarter, and by another 25 bps in the fourth quarter. —Kyle Aristophere T. Atienza",https://www.bworldonline.com/top-stories/2024/07/12/607650/marcos-appoints-top-banker-to-mb/
