title,author,date,article,link
NG’s use of GOCCs’ excess funds flagged,"Kyle Aristophere T. Atienza, ","July 16, 2024 | 12:32 am","ByKyle Aristophere T. Atienza,Reporter BUDGET ANALYSTS on Mondayflagged the National Government (NG) for diverting excess funds from state-owned companies, noting that the move may compromise their services while the funds may likely be used by politicians as the 2025 polls near. The move is a populist approach to addressing the fiscal situation, with the government refusing to push for new taxes despite implementing new programs and projects, they added. However, the Department of Finance (DoF) in a statement defended the move, saying that tapping “unused and idle” funds of GOCCs is a “more prudent fiscal option than borrowing more or imposing taxes.” Data from the Bureau of the Treasury (BTr) showed that the Philippine Health Insurance Corp. (PhilHealth) and the Philippine Deposit Insurance Corp. (PDIC) in May remitted P20 billion and 30 billion, respectively, to the NG — thanks to an overlooked provision in the 2024 national budget law authorizing a cash sweep from government-owned and -controlled corporations (GOCCs). Zy-za Nadine M. Suzara, a public budget analyst and former executive director of policy think tank Institute for Leadership, Empowerment, and Democracy, said the move should be a cause for public concern since it “compromises their ability” to deliver their mandated services. Initially, the Executive branch requested only P281.91 billion in unprogrammed funds in the then-proposed 2024 national budget. But in the 2024 General Appropriations Act (GAA) or thefinal version of the national budget that President Ferdinand R. Marcos, Jr. signed in December 2023, unprogrammed funds ballooned to P731.45 billion, prompting several legislators tofile a case before the Supreme Court. The case is still ongoing. From the usual three sources of unprogrammed funds such as excess revenue collections, new revenues from tax or nontax sources, and approved loans for foreign-assisted projects, the 2024 GAA also included fund balance of GOCCs with consideration of their disbursement in previous years. “Those funds were appropriated for a reason. The solution to poor spending is not to keep taking out the funds but to improve the capacity of institutions to efficiently deliver their respective mandates,” Ms. Suzara said. She noted tapping into the funds of the GOCCs is very similar to what legislators initially wanted to do in the original version of the Maharlika Investment Fund, which received seed funding from the Land Bank of the Philippines and the Development Bank of the Philippines. “This is in fact worse than the earlier version of Maharlika because it gives blanket authority to the National Government to do a cash sweep of just about any GOCC that’s unable to disburse funds,” she explained “At least in Maharlika, theGOCCs were identified in the bill.” Ms. Suzara said if GOCCs continue to underspend, then it is very likely that they will remit more funds to the Treasury tofinance the long list of items under unprogrammed appropriations in the 2024 budget. “It is ironic that budget items in the unprogrammed appropriations appear to be more of a priority as election nears when in reality, the unprogrammed appropriations is supposed to be just a standby fund for things that aren’t funded in the programmed appropriations,” she added. “If this is left unchallenged, then we can expect this to continue as the national budget grows annually.” Economic managers are proposing a P6.352-trillion national budget for 2025, a 10% increase from this year’s P5.768-trillion budget. Cielo D. Magno, a professor at the University of the Philippines School of Economics who had served as Finance undersecretary under the Marcos Jr. administration, said what the Congress did at the bicameral conference for the 2024 national budget was “unconstitutional” because it was in effect “trying to amend existing laws and charters of GOCCs by inserting a provision in the GAA tofinance the unappropriated portion of the GAA.” “Congress expanded the budget significantly through the unappropriated portion and tried tofind the money tofinance it by getting the GOCCs’ reserved fund,” she said in an e-mail. “This happened during the bicameral meeting, not during the actual deliberation/consultation of the proposed 2024 budget.” The move shows the “opaqueness” of the budget process, the opportunities for abuse, and the lack of accountability, she noted. In line with this year’s GAA, the DoF last February issued Circular 003-2024 which set the guidelines for financing unprogrammed appropriations sourced from the fund balance of GOCCs. Citing the circular and the GAA, the DoF asked the PhilHealth to remit its unutilized funds worth P89.9 billion to the Treasury. The landmark Universal Health Care (UHC) Act mandates the state insurer to use its excess funds to boost the benefits of its members and reduce the amount of their annual contributions. “No portion of the reserve fund or income thereof shall accrue to the general fund of the national government or to any of its agencies or instrumentalities, including government-owned or controlled corporations,” according to Section 11 of the UHC law. ‘DOES NOT AFFECT VIABILITY’The DoF defended the move to transfer funds from PhilHealth and PDIC to finance unprogrammed appropriations. “The move does not affect the viability of participating corporations. It does not impair their delivery of services,” it said. The DoF said PhilHealth and PDIC’s respective boards “approved” the return of excess and unused funds. “The result promotes the common good, based on the list of recipients identified in the national budget.” It also noted that in the case of PhilHealth, “unused government subsidies are not part of its reserve funds, nor income that is being restricted by the UHC Act to be used by the National Government as a general fund.” Former Department of Health advisor Antonio J. Leachon said in a statement that excess PhilHealth funds that will be returned to the unprogrammed fund of the national budget are revenues from taxes on tobacco, vapes, alcohol, and sugar-sweetened beverages, “which are specifically earmarked for health programs.” “It is alarming that despite having excess funds, PhilHealth has yet to comply with the provisions in Section 11 of RA 11223,” he said. PhilHealth’s reserve fund hit P463.7 billion in 2023. Ms. Suzara said that in the case of PhilHealth, private hospitals as well as direct and indirect contributors are affected by the NG’s use of its excess funds. Most vulnerable are indirect contributors such as indigents, beneficiaries of the government’s conditional cash transfer program or the Pantawid Pamilyang Pilipino Program, senior citizens, persons with disabilities, those sponsored by local governments and other Filipinos aged 21 years old and above without capacity to pay premiums, Ms. Magno noted. Ms. Magno said PhilHealth beneficiaries are supposed to be getting expanded services from the state insurer but it’s not happening “because instead of pressuring and reforming PhilHealth, we are defunding it.” Lawmakers who were able to insert their pet projects for funding under unprogrammed appropriations are the gainers, she added. Ms. Magno described the NG’s act of depriving GOCCs of their excess funds as “populist,” saying it has refused to look for other sources of revenues while “reducing the budget for important programs like PhilHealth.” “But [it has] continuously increased programs and projects that shouldn’t have been prioritized like the confidential and intelligence funds, and the insertions of congressmen and senators,” she said. “Misplaced priorities, definitely not for the benefit of the Filipino people.” Finance Secretary Ralph G. Recto has reiterated there will be no new taxes under the Marcos administration. “It is difficult for civil society and the media to monitor how the National Government is using funds from the GOCCs because there is no real-time reporting of this,” Ms. Suzara said, adding that while the Department of Budget and Management and the Treasury bureau consistently upload reports, they only contain aggregatefigures. “How do we know where the funds are funneled? Which localities or districts benefit? What projects are funded?” she asked. “We will find out about these things only after the Commission on Audit does its audit.” She urged the Marcos administration to proactively report how the funds from GOCCs are used through a dashboard. Ms. Magno said she and her colleagues are planning to question the validity and constitutionality of the insertions in the GAA and the DoF Circular 003-2024. “We are going tofile a petition before the Supreme Court,” she said.",https://www.bworldonline.com/top-stories/2024/07/16/608210/ngs-use-of-goccs-excess-funds-flagged/
Meralco rates up by P2 per kWh in July as power costs ‘normalize’,"Sheldeen Joy Talavera, ","July 16, 2024 | 12:33 am","BySheldeen Joy Talavera,Reporter HOUSEHOLDS SERVED by Manila Electric Co. (Meralco) will face higher power bills this month as rates go up by more than P2 per kilowatt-hour (kWh) due to a normalization in power costs. In a statement on Monday, Meralco said the overall rate would increase by P2.1496 per kWh to P11.6012 per kWh in July from P9.4516 per kWh in June. The power distributor attributed this hefty increase to the higher generation charge “as power costs normalized following artificially low rates last month.” Households consuming 200 kWh will see their monthly bill go up by around P430. Meanwhile, households consuming 300 kWh, 400 kWh, and 500 kWh would see an increase in their monthly bills by P645, P860, and P1,075, respectively. Joe R. Zaldarriaga, Meralco’s vice-president and head of corporate communications, said at a briefing that the latest adjustment is “almost unchanged without the steep reduction last month.” “Our power rates returned to normal that is why from P9.45 (per kWh), we are now back to the P11 range, to be exact, P11.60 (per kWh),” he said. Driving this month’s increase was the generation charge, which climbed by P2.0021 per kWh as the charges from the Wholesale Electricity Spot Market (WESM) returned to the normal level and as Meralco started the collection of deferred costs. To recall, the June electricity rate was supposed to be higher than May but was reduced by P1.9623 per kWh after the Energy Regulatory Commission (ERC) ordered the staggered collection of charges related to WESM purchases over a four-month period to soften the impact of the high generation rates. Aside from the ERC’s order, Meralco also requested, along with Quezon Power (Philippines) Ltd., San Buenaventura Power Ltd. Co. (SBPL), and South Premiere Power Corp. (SPPC), to stagger the collection of around P500 million in May generation costs until September. “We had a disclaimer as early as last month that in the month of July, anticipate that the increase will be significant as electricity prices will return to its previous level plus the deferred cost will be charged,” Mr. Zaldarriaga said in mixed Filipino and English. For this month, WESM charges went up by P6.637 per kWh “as charges not only normalized but also reflected the recovery of a portion of deferred WESM costs from the May supply month.” Meralco said, however, the increase was mitigated by the reduction in spot market prices as average demand in the Luzon grid went down by about 900 megawatts. Charges from independent power producers (IPPs) rose by P0.4392 per kWh due to higher fuel costs and lower average plant dispatch. “Charges from power supply agreements (PSAs) also went up by P0.3530 per kWh, as charges normalized and included the recovery of deferred costs for SBPL and SPPC’s 2024 EPSA (emergency power supply agreement),” Meralco said. WESM, IPPs, and PSAs accounted for 34%, 28%, and 38% of the company’s total energy requirement for July. Meanwhile, the transmission charge dropped by P0.1550 per kWh “due to the absence of reserve market settlement charges that affected last month’s ancillary service charges.” In March, the ERC ordered the temporary suspension of the billing and settlement of amounts in the reserve market following the significant price increase reported for the month compared with February. Taxes and other charges went up by P0.3025 per kWh. “This month’s rates included an adjustment in generation, transmission, system loss, and lifeline subsidy charges, under the ERC rules governing automatic cost adjustments and true-up mechanism for pass-through charges,” Meralco said. Distribution charge has remained unchanged at P0.0360 per kWh since August 2022. Lawrence S. Fernandez, Meralco’s vice-president and head of utility economics, said that there is a possibility of lower rates in August as demand further declines. “We saw in the spot market that because the rainy season has started, demand also went down and the reserve levels in the spot market have improved, so the price in the spot market also went down. So hopefully, this will continue, and this is reflected in the August generation charge,” Mr. Fernandez said in mixed Filipino and English. Data from the Independent Electricity Market Operator of the Philippines showed that as of June 25, the initial average WESM price for the entire country went down by 25.2% to P6.15 per kWh. Meanwhile, Mr. Zaldarriaga said this month’s bills would be delayed as Meralco sought the guidance from the ERC on the implementation of July rate adjustment. “Rest assured that Meralco will adjust the due dates to give our customers enough time to settle their bills,” he said in a statement. Meralco’s controlling stakeholder, Beacon Electric Asset Holdings, Inc., is partly owned by PLDT Inc. Hastings Holdings, Inc., a unit of PLDT Beneficial Trust Fund subsidiary MediaQuest Holdings, Inc., has an interest inBusinessWorldthrough the Philippine Star Group, which it controls.",https://www.bworldonline.com/top-stories/2024/07/16/608211/meralco-rates-up-by-p2-per-kwh-in-july-as-power-costs-normalize/
Fastest in five months: Cash remittances jump by 3.6% in May — BSP,"Luisa Maria Jacinta C. ,Jocson, ","July 16, 2024 | 12:34 am","ByLuisa Maria Jacinta C.Jocson,Reporter MONEY SENT HOME by overseas Filipino workers (OFWs) rose by 3.6% in May, its fastest pace infive months, data from the Bangko Sentral ng Pilipinas (BSP) showed. The BSP on Monday reported that cash remittances coursed through banks grew by 3.6% to $2.58 billion in May from $2.49 billion in the same month a year ago. The growth in cash remittances was its fastest infive months or since the 3.8% logged in December 2023.  Month on month, remittances inched up by 0.8% from $2.56 billion in April. “The expansion in cash remittances in May 2024 was due to growth in receipts from both land- and sea-based workers,” the BSP said in a statement. Remittances from land-based workers jumped by 3.8% to $2.06 billion while money sent home by sea-based workers grew by 2.6% to $519.373 million. In the January-to-May period, cash remittances increased by 3% to $13.365 billion from $12.981 billion a year ago. This was also its fastest pace of annual growth in a year or since the 3.1% recorded in May 2023. “The growth in cash remittances from the United States, Saudi Arabia, and Singapore contributed mainly to the increase in remittances in January-May 2024,” the central bank said. In thefirstfive months, the United States accounted for 40.9% of total remittances. This was followed by Singapore (7.2%), Saudi Arabia (6.1%), Japan (5.1%), the United Kingdom (4.7%), the United Arab Emirates (4%), Canada (3.4%), Korea (2.8%), Qatar (2.8%) and Taiwan (2.7%). “This 3.6% increase (in May), reaching $2.58 billion, suggests a combination of positive factors. Economic growth in key remittance source countries like the US, Saudi Arabia, and Singapore might be putting more money in the pockets of OFWs,” Security Bank Corp. Chief Economist Robert Dan J. Roces said in a Viber message. Mr. Roces said that rising wages of OFWs could also be another factor behind faster remittance growth. “Finally, favorable exchange rates incentivize sending more money back as it translates to a bigger bump in Philippine pesos received,” he added. In May, the peso sank to the P58-per-dollar level for thefirst time since November 2022. “The continued growth nevertheless is still a good signal for the overall economy as an important growth driver, especially in terms of consumer spending, which accounts for about 74% of the Philippine economy,” Rizal Commercial Banking Corp. Chief Economist Michael L. Ricafort said in a Viber message. Mr. Ricafort also noted there was a seasonal increase in remittances due to the summer holiday. Meanwhile, personal remittances rose by 3.7% to $2.88 billion during the month from $2.78 billion. This brought personal remittances at end-May to $14.89 billion, higher by 3% from $14.46 billion in the same period a year ago. “The increase in personal remittances in May 2024 was due to remittances from land-based workers with work contracts of one year or more and sea- and land-based workers with work contracts of less than one year,” the BSP added. For the coming months, Mr. Ricafort said he expects modest growth in remittances as OFW families “still need to cope up with relatively higher prices locally that would require the sending of more remittances.” For thefirst six months of the year, headline inflation averaged 3.5%. This was slightly higher than the central bank’s 3.3% full-year forecast. Mr. Ricafort also noted there is a seasonal increase in remittances during the July-August period due to the need to pay for school tuition payments. The central bank expects cash remittances to grow by 3% this year.",https://www.bworldonline.com/top-stories/2024/07/16/608212/fastest-in-five-months-cash-remittances-jump-by-3-6-in-may-bsp/
BoI says investment approvals may hit P1.6T this year,Justine Irish D. Tabile,"July 17, 2024 | 12:31 am"," APPROVED investment pledges may hit P1.6 trillion this year, amid expectations of higher inflows of foreign direct investments (FDIs) and the pipeline of green lane-endorsed projects, aTrade official said. Board of Investments (BoI) Managing Head and Trade Undersecretary Ceferino S. Rodolfo said the positive outlook stems from the central bank’s hike in projected FDI net inflows this year. “(The Bangko Sentral ng Pilipinas) increased its projection to $9.5 billion despite the drop in net FDI in April, and considering that the overall January-April number is still up and the pipeline of projects is still up, we are thinking of adjusting the upper limit to P1.6 trillion,” he told reporters on the sidelines of the Tatak Pinoy Act Forum on Monday. Latest BSP data showed FDI net inflows fell by an annual 36.9% to $556 million in April, the lowest level in 10 months. This brought FDI net inflows in the January-to-April period to $3.525 billion, up 18.7% from $2.971 billion a year ago. The BoI had previously set an internal target of approving P1.25 trillion to P1.5 trillion in investment pledges this year. The latest figures from the BoI showed that investment approvals reached P950 billion in thefirst six months, representing 59.4% of the agency’s P1.6-trillion target for the year. In 2023, the BoI approved P1.26 trillion worth of investment pledges. Mr. Rodolfo said the pipeline of projects under the green lane has also added to the optimistic outlook for higher investments this year. The government had established the green lane in all government agencies in order to speed up the approval and registration process for priority or strategic investments. As of June 20, P2.32 trillion worth of projects were endorsed to its One-Stop Action Center for Strategic Investments since it was established last year. “But the total projects that were registered out of that are only P1.31 trillion. So, in effect, we still have P1 trillion worth of projects that are not yet registered but are in the pipeline,” he added in mixed English and Filipino. The majority or 65 of the projects certified for the green lane system are renewable energy (RE) projects with a combined cost of P1.95 trillion. In its report, the BoI said that only 32 out of the 74 projects approved since last year are already registered with the BoI, with a total project cost of P1.31 trillion. The remaining 42 projects worth P1.02 trillion are still being eyed for registration. Mr. Rodolfo said that BoI will remain very aggressive in promoting and converting projects in the pipeline to actual registration. Last month, Trade Secretaryand BoI Chairman Alfredo E. Pascual said that 65 projects worth around $19 billion have been realized so far from the deals secured during President Ferdinand R. Marcos, Jr.’s trips. Of the projects initiated, 12 are already operating and are registered with an investment promotion agency. These are valued at $328 million. Some 21 projects worth $1.6 billion have registered but are not yet operating, while 32 projects valued at $17 billion are in the process of registering. The initiated projects account for 30% of the $61.3 billion worth of investment leads gathered during the President’s trips, which covers 201 projects. —Justine Irish D. Tabile",https://www.bworldonline.com/top-stories/2024/07/17/608544/boi-says-investment-approvals-may-hit-p1-6t-this-year/
BIR collection of withholding tax from online sellers starts,"Beatriz Marie D. Cruz, ","July 17, 2024 | 12:32 am","ByBeatriz Marie D. Cruz,Reporter THE BUREAU of Internal Revenue(BIR) on Monday started collecting a withholding tax on online platforms and sellers. At the same time, the BIR extended the transition period for digital financial service providers by another 90 days to mid-October. BIR Commissioner Romeo D. Lumagui, Jr. said in a statement that electronic marketplace operators started imposing the withholding tax against sellers and merchants on July 15. “We have already extended this by 90 days. No further extensions will be given,” he said. A withholding tax is not a new form of tax, but an advance payment collected from the total income tax liability of an online seller. Under Revenue Regulations (RR) No. 16-2023, a withholding tax of 1% will be imposed on one-half of the gross remittances by e-marketplace operators and digital financial service providers to the sellers or merchants for the goods and services paid or sold through their platforms or facilities. In April, the BIR extended the transition period for another 90 days, or until July 14, in response to the request of the private sector. This regulation covers marketplaces for online shopping, food delivery platforms, platforms to book lodging accommodations, and other similar online service or product marketplaces. “The BIR aims to level the playing field between brick-and-mortar stores, which are regularly complying with their tax obligations, and online marketplaces,” Mr. Lumagui said. “Whether their business is operated online or through physical stores, sellers and merchants have to pay their taxes.” However, the BIR clarified that the tax will not be imposed if the annual total gross remittances to an online seller for the past taxable year has not exceeded P500,000; if the cumulative gross remittances to an online seller in a taxable year has not yet exceeded P500,000 or if the seller is duly exempt from or subject to a lower income tax rate pursuant to any existing law or treaty. Eleanor L. Roque, tax principal of P&A Grant Thornton, said the BIR’s move would help capture the appropriate taxes from the online marketplace. “If there is a discrepancy in the gross transactions and amount of withholding taxes, the online sellers will be asked to explain or reconcile the difference. This is the same process when the BIR audits any taxpayer,” she said in a Viber message. Meanwhile, the BIR issued a circular that extended the transition period for digital financial service providers to comply with the withholding tax by another 90 days or until Oct. 12. The transition period was supposed to have ended on July 14. BIR said the extension was meant “to provide additional time to the digital financial services providers to finally complete their respective system adjustments for compliance with the requirements of Revenue Regulations 16-2023.” The digital economy’s annual contribution to the country’s economic output fell as its growth slowed down in 2023. In 2023, the digital economy’s share to the country’s gross domestic product (GDP) went down to 8.4% from 8.6% in 2022. This was its lowest share to GDP since 2018. In terms of gross value added, the digital sector grew by 7.7% to P2.05 trillion last year from the P1.9 trillion recorded in 2022. The country’s digital economy is projected to reach up to $150 billion by 2030, according to a 2023 report by Google, Temasek Holdings and Bain & Company.",https://www.bworldonline.com/top-stories/2024/07/17/608545/bir-collection-of-withholding-tax-from-online-sellers-starts/
