title,author,date,article,link
143 PPP projects in the pipeline — NEDA,B.M.D.Cruz,"July 15, 2024 | 12:31 am"," THE GOVERNMENT has 143 public-private partnership (PPP) projects valued at P3.095 trillion in the pipeline as of July, with new projects centered on health and waste management, the National Economic and Development Authority (NEDA) said. “The number of pipeline projects has grown over these past few months. As of early July, we have 205 PPP projects, including those in local government units, under implementation and 143 projects in thepipeline,” NEDA Secretary Arsenio M.Balisacan was quoted as saying in a statement. Nine PPP projects amounting to P65 billion were added to the pipeline as of July. “We are also encouraged to note that more and more social infrastructure projects in health, water and sanitation, as well as solid waste management, are in the pipeline,” Mr. Balisacan added. The National Government leans on support from the private sector in shouldering its budgetary and infrastructure project implementation shortfalls. It has passed several policies over the past months that seek to create an enabling environment for infrastructure development. Republic Act No. 11966 or the PPP Code, which took effect in December last year, sought to increase private sector participation infinancing, operating, and maintaining infrastructure projects. Under the Marcos administration’s “Build Better More” program, the government has 185 infrastructureflagship projects (IFP) valued at P9.54 trillion in the pipeline. Mr. Balisacan also said that 63 IFPs, including the Pasig-Marikina River channel improvement project, Central Luzon Link Expressway, and the Panguil Bay Bridge project, are currently underway. The NEDA chief said 31 more IFPs have been approved for implementation, six are awaiting government approval, and 82 are in the preparation stage. The government’s move to allow full foreign ownership in renewable energy projects as well as public utilities like telecommunications, domestic shipping, railways, subways, airlines, expressways, tollways and airports, is expected to increase foreign investments in infrastructure, Mr. Balisacan said. To fast-track implementation of infrastructure projects, the NEDA chief said there is a need to streamline and enhance processes and speed up the acquisition of right of way. In April, President Ferdinand R. Marcos, Jr. also signed Executive Order (EO) No. 59 to fast-track the processing of permits for infrastructure flagship projects. “By expanding and upgrading our infrastructure, we aim to create enabling conditions for high-quality job creation for millions of Filipinos, raise the competitiveness of our local industries, diversify our growth drivers to strengthen economic resilience, and enhance regional connectivity by linking our leading and lagging regions,” Mr. Balisacan said. Terry L. Ridon, a public investment analyst and convenor of think tank InfraWatch PH, said the pace of implementation of IFPs would depend on government agencies. “With legislation and policy frameworks in place, faster infrastructure development will now be determined by capable leadership of infrastructure agencies,” he said in a Viber message. “This leadership has not been apparent in the Transportation department with only one concluded PPP (Ninoy Aquino International Airport rehabilitation) by the President’s State of the Nation Address (in July.) The public is still waiting for its urgent action on the EDSA (Epifanio de los Santos Avenue) busway and MRT-3 (Metro Rail Transit Line 3) PPPs.” In May, the PPP Center said that its evaluation of Megawide Construction Corp.’s unsolicited proposal for the EDSA busway system is nearing completion. The Department of Transportation also said it is reviewing the terms of reference for the auction of MRT-3’s operations and maintenance contract by thefirst quarter of 2025. Rizal Commercial Banking Corp. Chief Economist Michael L. Ricafort said the government has implemented several measures, including the establishment of “green lanes,” to attract more investors in the Philippines. As of June 20, around P2.32 trillion worth of projects, mostly in renewable energy, have been approved to go through the “green lane” system, the Board of Investments said earlier. The government, through EO No. 18, established the “green lane” in all government agencies to speed up the approval and registration process for priority or strategic investments. —B.M.D.Cruz",https://www.bworldonline.com/top-stories/2024/07/15/607979/143-ppp-projects-in-the-pipeline-neda/
‘Larger-than-expected’ rate cuts likely — Nomura,Luisa Maria Jacinta C. Jocson,"July 15, 2024 | 12:32 am"," THE BANGKO SENTRAL ngPilipinas (BPS) may deliver “larger-than-expected” rate cuts, withthe possibility of up to 250 basis points (bps) worth of reductionsuntil 2025, Nomura Global MarketsResearch said. “Compared to our baseline, risks are skewed towards more easing in the Philippines and Thailand, less easing in India,” it said in a report. In June, the Monetary Board kept its benchmark rate unchanged for a sixth straight meeting at 6.5%, the highest in over 17 years. Nomura’s baseline forecast for the Philippines’ policy rate is at 5% at end-2025. However, its Modified Taylor Rule (MTR) estimates see the key rate slashed to as low as 4%. According to the report, the MTR estimates to “quantify where Asian policy rates ‘should be.’” Nomura’s baseline projection also anticipates the BSP to deliver a rate cut in October. It projects a total of 150 bps of cuts by the second quarter of 2025. “However, the MTR suggests this would leave policy rates in restrictive territory, given an imminent fall in inflation to below the midpoint of the 2-4% target range, partly aided by lower rice prices.” “The MTR suggests policy easing should begin in Q3 2024, with 250 bps of cumulative cuts to a terminal rate of 4% by Q2 2025,” it added. BSP Governor Eli M. Remolona, Jr. has said that the central bank is on track to begin policy easing by August. He said that the BSP could cut rates by up to 50 bps this year, with a 25-bp cut each in the third and fourth quarters. The Monetary Board has raised rates by a cumulative 450 basis points (bps) from May 2022 to October 2023. Nomura also noted the improved expectations of the US Federal Reserve cutting rates this year. “The global backdrop has also become more conducive, with US core (consumer price index) inflation softening in June and setting the stage for the Fed to cut policy rates twice this year, in September and December, consistent with our US economics team’s baseline views,” it said. US consumer prices fell for the first time in four years in June amid cheaper gasoline and moderating rents, firmly putting disinflation back on track and putting the Federal Reserve another step closer to cutting interest rates in September, Reuters reported. Financial markets saw a roughly 85% chance of a rate cut at the Fed’s September meeting, compared with about a 70% chance seen before the report. Two rate cuts are anticipated this year. Mr. Remolona earlier said that the BSP does not need to wait for the Fed before it begins cutting rates. He said that while the BSP monitors the Fed’s moves, it is not a “decisive factor” in its own monetary decisions. The Monetary Board’s (MB) next policy review is on Aug. 15. This is MB’s only meeting scheduled in the third quarter. It is also set to meet on Oct. 17 and Dec. 19, its last two meetings for the year. —Luisa Maria Jacinta C. Jocson",https://www.bworldonline.com/top-stories/2024/07/15/607980/larger-than-expected-rate-cuts-likely-nomura/
Debt service bill jumps in May,Beatriz Marie D. Cruz,"July 15, 2024 | 12:33 am","THE NATIONAL GOVERNMENT’S (NG)debt service bill jumped year on year in Maydue to a surge in interest payments, the Bureauof the Treasury (BTr) said. Data from the Treasury bureau showed that debt payments rose by 40.64% to P68.98 billion in May from P49.05 billion in the same month a year ago. Month on month, debt payments dropped by 57.34% from P161.7 billion in April. The debt service refers to payments made by the government on its domestic and foreign debt. The bulk (88.57%) of May’s debt service bill went to interest payments. Interest payments went up by 47.78% to P61.1 billion in May from P41.34 billion in the same month a year ago. Interest paid on domestic debt increased by 56% to P46.07 billion from P29.53 billion a year ago. Meanwhile, interest payments to foreign creditors grew by 27.18% to P15.03 billion in May from P11.82 billion a year ago. On the other hand, principal payments inched up by 2.34% to P7.88 billion from P7.7 billion last year. Month on month, amortization plunged by 92% from P94.2 billion in April. Broken down, amortization on domestic debt in May dropped by 96.8% to P85 million from P2.66 billion a year ago. Principal payments on external debt increased by 54.51% to P7.8 billion in May from P5.05 billion last year. FIVE MONTHSIn the first five months of the year, the NG’sdebt service bill increased by 48% to P1.22 trillion from P819.53 billion in the year-ago period. Amortization payments climbed by 51.73% to P895.13 billion in thefirst five months from P589.95 billion a year ago. Principal payments on domestic debt reached P754.86 billion, while those on external debt amounted to P140.27 billion. Meanwhile, interest payments in the January-to-May period jumped by 40.08% to P321.59 billion from P229.57 billion a year prior. Broken down, interest paid on domestic debt stood at P231.38 billion, while interest payments for external debt reached P90.21 billion. Rizal Commercial Banking Corp. Chief Economist Michael L. Ricafort said the higher debt payments in May could be due to the elevated interest rates and weaker peso. “The higher debt servicing bill of the NG could be attributed to higher interest rates that increased borrowing costs/financing costs,” he said via Facebook Messenger. Mr. Ricafort said the weaker peso exchange rate increased the peso equivalent of external debt and debt servicing. The peso closed at P58.52 against the dollar as of end-May, depreciating by P0.94 from its P57.58finish as of end-April. The Bangko Sentral ng Pilipinas has kept the key policy rate at an over 17-year high of 6.5% since October 2023. The higher debt payments could also reflect the wider budget deficit, Mr. Ricafort said. The NG’s budget deficit in May widened 43.1% to P174.9 billion amid strong spending over revenues, BTr said. In thefirst five months of the year, the budget gap ballooned by 24.06% to P404.8 billion from P326.3 billion a year ago. “There could also be some payment of some multilateral foreign debts, as well as some maturity of some local government securities/debts,” Mr. Ricafort said. As of end-May, the NG’s debt hit a record high P15.35 trillion, with P10.44 trillion coming from domestic sources and P4.9 trillion from foreign sources. —Beatriz Marie D. Cruz",https://www.bworldonline.com/top-stories/2024/07/15/607981/debt-service-bill-jumps-in-may/
PEZA investments plunge in June,Justine Irish D. Tabile,"July 15, 2024 | 12:34 am","THE PHILIPPINE EconomicZone Authority (PEZA) approved P8.65 billion worth of projects in June, 73.4% lower than a year ago. In a statement over the weekend, the investment promotion agency said the PEZA Board approved 25 new and expansion projects at its June 28 meeting, up from 22 projects a year ago. These projects are expected to contribute $416 million in export value and 5,881 direct jobs. However, the amount of PEZA-approved investments in June was 73.4% lower than the P32.56 billion worth of investments approved in the same month last year. Of the 25 projects, 22 are from locator companies and three from economic zone (ecozone) developers, PEZA said. “These locator companies comprise 11 export manufacturing projects, followed by six projects in information technology and business process management (IT-BPM), three in domestic markets, one in facilities development, and one in logistics services,” it added. Calabarzon was still the top investment destination in June, accounting for 15 projects. The other investment destinations were the National Capital Region, Region III (Central Luzon), Region V (Bicol Region), Region VII (Central Visayas),and Region XII (Soccsksargen). LOWER INVESTMENTSFor thefirst half, PEZA said it approved P45.48 billion worth of investments, plunging by 43.6% from the P80.59 billion worth of investments approved in the same period last year. The PEZA approved 120 projects which are expected to create over 25,000 jobs and generate $1.61 billion in export value. “The new projects approved recorded an 18% increase from 102 to 120, with projected direct employment reaching a remarkable 64% uptick from 15,424 to 25,259 this year,” PEZA said. PEZA Director-General Tereso O. Panga said that the approval of the 120 projects signals confidence in the country’s business environment and economic potential. “Creating more jobs for Filipinos signifies the agency’s proactive efforts in positioning the Philippines as a premier investment destination in Asia,” he said. During the six-month period, PEZA said it approvedfive big-ticket projects worth P31.36 billion. In June, it approved two projects worth P6.15 billion. A Malaysian company will set up a manufacturing and assembly facility for hair stylers, while a Japanese company will manufacture biomass fuel products, oxygen reducers, and activated charcoal made from coconut shells in General Santos City. From January to June, the top investment sources were the Cayman Islands (P8.86 billion), Japan (P8.02 billion), Malaysia (P4.53 billion), Hong Kong (P1.62 billion), and Singapore (P1.27 billion). The electronic manufacturing services sector attracted the most investments, accounting for P19.77 billion. This was followed by the ecozone development (P16.21 billion), IT-BPM industry (P2.89 billion), and automotive (P1.04 billion). “Eastern European countries are also quite interested in the Philippines, with visits from Ukrainian, Polish, and Russian delegations conducting inquiries and site visits preparatory to investing in the country,” PEZA said. PEZA is hoping to approve between P200 billion and P250 billion worth of investments this year. If realized, this will be at least a 15% growth from the P175.71 billion worth of investments approved in 2023. —Justine Irish D. Tabile",https://www.bworldonline.com/top-stories/2024/07/15/607982/peza-investments-plunge-in-june/
PHL likely to grow by 5-6% this year — House think tank,"Kenneth Christiane L. ,Basilio","July 16, 2024 | 12:31 am","ByKenneth Christiane L.Basilio THE GOVERNMENT of PresidentFerdinand R. Marcos, Jr. mighthave done enough pump-priming and should let the private sector take on a bigger role in boosting the economy, according to a congressional think tank. “The resilience and ingenuity demonstrated by Filipinos, particularly in crises, should serve as a reminder that the government can trust the private sector to do its part in growing the economy. To realize this potential, policy makers must prioritize providing a favorable environment for businesses to thrive,” the Congressional Policy and Budget Research Department (CPBRD) said in a report on Monday. “This includes lowering regulatory burdens, improving infrastructure, investing in education and skills development in areas that offer the highest economic returns, and fostering competition,” it added. The Philippine economy would probably grow by 5.02% to 6.17% this year, compared with the government target of 6-7%, the CPBRD said, noting that heightened inflationary pressures, tightening fiscal constraints, weak capital formation and anemic growth in critical productive sectors could further hamper growth. The think tank said inflation is still a “large and growing threat to economic growth and stability.” “If prevailing inflationary pressure remains unabated, the likelihood of an economic slowdown is heightened,” it added. For the first six months of 2024, headline inflation averaged 3.5%, slightly higher than the central bank’s 3.3% full-year forecast. “Anticipated shifts in regional and global value chains, tightening fiscal constraints, growing geopolitical instability, and the Philippines’ vulnerability to climatic shocks (i.e., a single typhoon that hits Central Luzon has the outsized potential to severely aggravate existing agricultural productivity issues) are other potential threats on the horizon,” the think tank said. The CPBRD expects growth momentum to continue in the second and third quarters, before decelerating in the fourth quarter. In a low-growth trajectory, the think tank sees gross domestic product (GDP) expanding by 5.05% in the second quarter, 5.7% in the third quarter and 3.56% in the fourth quarter. “The low-growth trajectory can be viewed as the expected scenario if inflation accelerates and begins eroding productivity — sooner rather than later,” it said. On the other hand, the CPBRD’s high-growth scenario sees GDP expanding by 6.3% in the second quarter, 7.04% in the third quarter and 5.35% in the fourth quarter. “While the Philippine economy faces significant headwinds, it also has the potential for robust and inclusive growth. The path forward necessitates a balanced approach that addresses immediate challenges while laying the foundation for long-term sustainable development,” the CPBRD said. The think tank said a strong partnership between the government and the private sector can help the Philippines realize its full economic potential. The Philippine economy faces both challenges and opportunities in the current global economic landscape, it said. “Exploiting its strengths in services, manufacturing, and agriculture, the country can position itself as a competitive player in emerging regional markets — and eventually the global market,” it said. “This, however, requires a collaborative effort from both the public and private sectors to build robust markets, foster innovation, and leverage emerging technologies.” Meanwhile, Security Bank Corp. Chief Economist Robert Dan J. Roces said the government’s 6-7% GDP growth target is not out of reach despite elevated interest rates and high inflation. “Rising remittances and a potential infrastructure spending boost offer promising signs,” he said in a Viber message. “Streamlining regulations, investing in vital infrastructure, and nurturing a skilled workforce can unlock private sector potential beyond restrictive requirements,” Mr. Roces said adding that the Marcos administration’s focus on infrastructure and public-private partnerships is a step in the right direction. The government should also limit its intervention in the economy to allow the private sector to stimulate the local economy, Leonardo A. Lanzona, an economics professor at the Ateneo de Manila, said in a Facebook Messenger chat. “The economy is so dependent on government expenditures that any underspending causes a negative effect on growth,” he toldBusinessWorld. “With private consumption and investment declining, the government in turn has crowded out the private sector and hence not been able to meet its targets.” Rizal Commercial Banking Corp. Chief Economist Michael L. Ricafort said Philippine GDP growth could normalize to around 5.5-6.5% annually in the coming years. In a Viber message, he said it would be possible for the Philippines to achieve 6% GDP growth in the following quarters due to the continued recovery of businesses and increases in government spending in preparation for the 2025 midterm elections.",https://www.bworldonline.com/top-stories/2024/07/16/608151/phl-likely-to-grow-by-5-6-this-year-house-think-tank/
